{
  "title": "Acting on design feedback",
  "idea": "Iteration is turning review comments into small, tested design changes, and a good design makes most of those changes local to one class.",
  "points": [
    "Log every comment as a bug, missing requirement, or preference.",
    "Bugs and missing requirements mean fix now; preferences mean discuss or known trade-off.",
    "Change one class at a time and rerun your tests after each change.",
    "If one comment forces edits in many classes, revisit that boundary."
  ],
  "hero": {
    "type": "flow",
    "title": "The feedback loop",
    "nodes": [
      {
        "id": "show",
        "label": "Present design",
        "sub": "classes and flows"
      },
      {
        "id": "log",
        "label": "Log comments",
        "sub": "word for word"
      },
      {
        "id": "sort",
        "label": "Triage",
        "sub": "bug, gap, preference"
      },
      {
        "id": "change",
        "label": "Change one class",
        "sub": "smallest edit"
      },
      {
        "id": "test",
        "label": "Rerun tests",
        "sub": "nothing else broke"
      }
    ],
    "edges": [
      {
        "from": "show",
        "to": "log",
        "label": "listen",
        "caption": "Write each comment down as said. Do not defend or fix during the review."
      },
      {
        "from": "log",
        "to": "sort",
        "label": "classify",
        "caption": "Label each comment a bug, a missing requirement, or a preference. The first two are c05-t08's fix now."
      },
      {
        "from": "sort",
        "to": "change",
        "label": "pick one",
        "caption": "Take the most important fix-now item. Preferences go to discuss or a known trade-off."
      },
      {
        "from": "change",
        "to": "test",
        "label": "verify",
        "caption": "Rerun the tests. A green run means nothing else broke."
      },
      {
        "from": "test",
        "to": "show",
        "label": "next round",
        "back": true,
        "caption": "Show the updated design and start the next round with fresh eyes."
      }
    ]
  },
  "code": [
    {
      "file": "policy.mjs",
      "lang": "js",
      "title": "A comment becomes a class",
      "run": "browser",
      "caption": "Times are hours as numbers, so 0.25 is 15 minutes.",
      "walk": [
        {
          "lines": [
            1,
            2,
            3,
            4,
            5,
            6,
            7,
            8
          ],
          "text": "The base class is the interface; `StrictOverlapPolicy` is the rule you presented."
        },
        {
          "lines": [
            9,
            10,
            11,
            12,
            13,
            14,
            15,
            16,
            17
          ],
          "text": "The reviewer's request becomes `BufferPolicy`, the gap rule from c05-t03. No existing class is edited."
        },
        {
          "lines": [
            18,
            19,
            20,
            21,
            22
          ],
          "text": "`BookingRepository` holds the bookings, so the service keeps no list of its own."
        },
        {
          "lines": [
            23,
            24,
            25,
            26,
            27,
            28,
            29,
            30,
            31,
            32,
            33,
            34,
            35
          ],
          "text": "`BookingService` passes the room's bookings to whichever policy it was given."
        },
        {
          "lines": [
            36,
            37,
            38,
            39,
            40
          ],
          "text": "Same bookings, two policies: back-to-back meetings pass one rule and fail the other."
        }
      ]
    }
  ],
  "takeaway": "Log, triage, change one class, rerun tests, present again.",
  "chat": {
    "starters": [
      "What if I disagree with a reviewer's comment?",
      "How do I tell a design bug from a style preference?",
      "When is a change too big to make before submission?"
    ]
  }
}
